{
  "case_id": "JVM-JAVA-01",
  "slug": "java-jackson-xml-empty-element",
  "title": "Jackson XML empty elements deserialize as empty strings",
  "status": "verified_keep",
  "primary_scenario": "parsing-and-ingestion",
  "application_scenarios": [
    "parsing-and-ingestion"
  ],
  "ecosystems": [
    "jvm"
  ],
  "languages": [
    "java"
  ],
  "api_surfaces": [
    "xml-parser",
    "library-api"
  ],
  "drift_patterns": [
    "parser-rule-changed",
    "type-or-shape-changed"
  ],
  "failure_modes": [
    "wrong-type",
    "silent-value-change"
  ],
  "determinism": "local-deterministic",
  "external_dependencies": "package-cache",
  "old_version": "Jackson XML 2.11.x",
  "new_version": "Jackson XML 2.12.x",
  "source_urls": [
    "https://github.com/FasterXML/jackson/wiki/Jackson-Release-2.12"
  ],
  "provenance": {
    "reproduction_result": "data/verification/sequential_30/JVM-JAVA-01",
    "verified_at": "2026-05-21"
  }
}
