{
  "case_id": "RB-RSP-009",
  "slug": "ruby-rspec-aggregate-failures-return",
  "title": "RSpec aggregate_failures returns true on success",
  "status": "verified_keep",
  "primary_scenario": "runtime-semantics",
  "application_scenarios": [
    "runtime-semantics"
  ],
  "ecosystems": [
    "ruby"
  ],
  "languages": [
    "ruby"
  ],
  "api_surfaces": [
    "test-framework",
    "library-api"
  ],
  "drift_patterns": [
    "field-semantics-changed",
    "type-or-shape-changed"
  ],
  "failure_modes": [
    "silent-value-change",
    "wrong-type"
  ],
  "determinism": "local-deterministic",
  "external_dependencies": "package-cache",
  "old_version": "rspec-expectations 3.10.0",
  "new_version": "rspec-expectations 3.11.0",
  "source_urls": [
    "https://github.com/rspec/rspec-expectations/blob/main/Changelog.md"
  ],
  "provenance": {
    "reproduction_result": "data/verification/reverse_50/details/RB-RSP-009.json",
    "verified_at": "2026-05-21"
  }
}
