{
  "case_id": "SEED-20260520-005",
  "slug": "seed-20260520-005-meituan-merchant-id-is-unstable",
  "title": "Meituan merchant ID is unstable",
  "status": "blocked_runtime",
  "primary_scenario": "routing-and-identity",
  "application_scenarios": [
    "routing-and-identity"
  ],
  "ecosystems": [
    "external-api"
  ],
  "languages": [
    "http"
  ],
  "api_surfaces": [
    "service-api"
  ],
  "drift_patterns": [
    "field-semantics-changed"
  ],
  "failure_modes": [
    "wrong-entity"
  ],
  "determinism": "requires-live-credential",
  "external_dependencies": "requires-live-credential",
  "old_version": "verification source state",
  "new_version": "unverified reproduced state",
  "source_urls": [
    "https://h5.dianping.com/app/bep-docs/sky-doc/canyinopenapi/waimai_api.html",
    "docs/verification-runs/run-20260521-reverse-50.md"
  ],
  "provenance": {
    "reproduction_result": "data/verification/reverse_50/details/SEED-20260520-005.json",
    "verified_at": "2026-05-21",
    "migration_scope": "reverse_50",
    "original_status": "blocked_offline_reproduction",
    "first_blocked_step": "dependency_acquired"
  }
}
