{
  "case_id": "PY-STRICT-012",
  "slug": "python-loguru-serialized-json-non-ascii",
  "title": "Loguru serialized JSON stops escaping non-ASCII",
  "status": "verified_keep",
  "primary_scenario": "observability-and-logging",
  "application_scenarios": [
    "observability-and-logging"
  ],
  "ecosystems": [
    "python"
  ],
  "languages": [
    "python"
  ],
  "api_surfaces": [
    "json-logging",
    "library-api"
  ],
  "drift_patterns": [
    "field-semantics-changed"
  ],
  "failure_modes": [
    "silent-value-change"
  ],
  "determinism": "local-deterministic",
  "external_dependencies": "package-cache",
  "old_version": "0.5.3",
  "new_version": "0.6.0",
  "source_urls": [
    "https://loguru.readthedocs.io/en/latest/project/changelog.html"
  ],
  "provenance": {
    "reproduction_result": "data/verification/strict_python/python-loguru-serialized-json-non-ascii/attempt_001/result.json",
    "verified_at": "2026-05-23",
    "candidate_id": "python-loguru-serialized-json-non-ascii",
    "original_status": "verified_keep",
    "first_blocker": "",
    "candidate": "data/verification/strict_python/python-loguru-serialized-json-non-ascii/candidate.json"
  }
}
