{
  "case_id": "OLD15-014",
  "slug": "old15-ruby-toy-drift",
  "title": "Old15 Ruby Toy Drift",
  "status": "verified_keep",
  "primary_scenario": "runtime-semantics",
  "application_scenarios": [
    "runtime-semantics"
  ],
  "ecosystems": [
    "ruby"
  ],
  "languages": [
    "ruby"
  ],
  "api_surfaces": [
    "library-api"
  ],
  "drift_patterns": [
    "default-changed"
  ],
  "failure_modes": [
    "silent-value-change"
  ],
  "determinism": "local-deterministic",
  "external_dependencies": "local-deterministic",
  "old_version": "1.0.0",
  "new_version": "2.0.0",
  "source_urls": [
    "https://example.invalid/source-unavailable"
  ],
  "provenance": {
    "reproduction_result": "data/verification/old_15/old15-ruby-toy-drift/attempt_001/result.json",
    "verified_at": "2026-05-22T03:15:45.469568",
    "candidate_id": "ruby-toy-drift",
    "original_status": "verified_keep",
    "first_blocker": "",
    "candidate": "cases/ruby_toy_drift/candidate.json",
    "old_case_path": "cases/ruby_toy_drift",
    "old_case_id": "ruby_toy_drift"
  }
}
